{
  "format_version": 1,
  "semantics_version": 1,
  "features": [],
  "program": {
    "globals": [],
    "functions": [
      {
        "name": "answer",
        "parameters": [],
        "return_type": {
          "Int": {
            "bits": 128,
            "signed": false
          }
        },
        "body": [
          {
            "Return": {
              "Lit": {
                "Int": {
                  "bits": 128,
                  "signed": false,
                  "value": "340282366920938463463374607431768211455"
                }
              }
            }
          }
        ]
      }
    ]
  }
}
